{"definition":"For each grid cell, the 95th (5th) percentile of its own annual-mean anomalies over the reference period is the local threshold. The metric is the cos(lat)-weighted share of observed area whose annual-mean anomaly exceeds (falls below) it. In the reference period itself the in-sample share is about 6.7% (2 of 30 reference years lie above the interpolated 95th percentile), which is the baseline to compare against. These are ANNUAL-MEAN anomalies, not daily or heatwave extremes.","metrics":[{"area_share":[null,null,null,null,null,null,null,null,null,null,null,null,null,null,null,null,null,null,null,null,null,null,null,null,null,null,null,null,null,null,0.0717,0.0851,0.1068,0.061,0.0526,0.0429,0.0383,0.0553,0.123,0.1088,0.0629,0.0536,0.0906,0.0867,0.0472,0.0259,0.0963,0.1368,0.0521,0.0882,0.126,0.0624,0.09,0.036,0.0104,0.0816,0.0449,0.014,0.0155,0.0073,0.0137,0.0089,0.0159,0.0239,0.0573,0.0531,0.0288,0.0397,0.0334,0.0238,0.0198,0.0432,0.0215,0.0055,0.0158,0.0167,0.0526,0.0272,0.0326,0.0132,0.0274,0.0855,0.0474,0.0475,0.0708,0.0148,0.0382,0.0507,0.07,0.0743,0.219,0.3646,0.1024,0.138,0.1844,0.1945,0.0837,0.0779,0.0356,0.0708,0.0425,0.0288,0.0369,0.0892,0.037,0.049,0.0417,0.0735,0.1189,0.0568,0.0347,0.0634,0.0653,0.0765,0.0119,0.0087,0.0331,0.0325,0.039,0.1224,0.0433,0.0507,0.086,0.1699,0.0623,0.0544,0.0319,0.0995,0.0495,0.1189,0.221,0.1811,0.1733,0.2884,0.1652,0.137,0.1474,0.3928,0.3775,0.2293,0.3282,0.301,0.2404,0.2087,0.2628,0.3431,0.2869,0.4081,0.5446,0.4103,0.3543,0.4824,0.5403,0.5334,0.487,0.5771,0.5216,0.5594,0.4766,0.5733,0.5719,0.5492,0.5363,0.5897,0.6229,0.7022,0.755,0.7198,0.691,0.7298,0.7277,0.6802,0.7281,0.8483,0.8334,0.8335],"expected_share_in_reference":0.0669,"id":"gistemp_above_p95_1951-1980","label":"Share of area above the local 95th percentile of 1951-1980","n_cells_with_reference":15833,"reference":"1951-1980","source":"gistemp","valid_area_share":[null,null,null,null,null,null,null,null,null,null,null,null,null,null,null,null,null,null,null,null,null,null,null,null,null,null,null,null,null,null,0.8379,0.8454,0.8548,0.8546,0.8491,0.8492,0.865,0.8685,0.8669,0.8686,0.8691,0.8781,0.8748,0.8722,0.8918,0.8842,0.893,0.9015,0.9055,0.9031,0.9116,0.9146,0.9181,0.9218,0.9266,0.9324,0.9297,0.9331,0.9333,0.9332,0.9338,0.9307,0.9354,0.9384,0.9397,0.9403,0.9399,0.9397,0.94,0.9394,0.9409,0.9398,0.9412,0.9409,0.9417,0.9421,0.9456,0.9467,0.9471,0.9471,0.947,0.9531,0.9533,0.9533,0.9478,0.9478,0.9532,0.953,0.9531,0.9539,0.9537,0.955,0.9543,0.9497,0.9521,0.9521,0.9581,0.9589,0.9597,0.959,0.9644,0.9661,0.9586,0.9586,0.9669,0.9727,0.9878,1.0,1.0,1.0,0.9996,0.9996,1.0,1.0,1.0,1.0,1.0,1.0,1.0,1.0,1.0,1.0,1.0,1.0,1.0,1.0,1.0,1.0,1.0,1.0,1.0,1.0,0.9997,0.9997,1.0,1.0,1.0,1.0,1.0,1.0,1.0,1.0,0.9998,1.0,1.0,1.0,1.0,0.9997,0.9997,1.0,0.9997,1.0,1.0,1.0,0.9997,1.0,1.0,1.0,1.0,1.0,1.0,1.0,1.0,1.0,1.0,1.0,1.0,1.0,1.0,1.0,1.0,1.0,1.0,1.0,1.0,0.9998]},{"area_share":[null,null,null,null,null,null,null,null,null,null,null,null,null,null,null,null,null,null,null,null,null,null,null,null,null,null,null,null,null,null,0.2285,0.1257,0.1614,0.2367,0.3283,0.3352,0.2722,0.3488,0.2969,0.1818,0.372,0.2209,0.2873,0.3713,0.3264,0.2094,0.1757,0.1645,0.2341,0.2829,0.1759,0.1819,0.3311,0.3539,0.4577,0.3655,0.2714,0.375,0.4132,0.4474,0.4197,0.425,0.3694,0.3746,0.2695,0.1891,0.33,0.4629,0.3494,0.2601,0.2739,0.2047,0.2497,0.2688,0.2397,0.2527,0.1906,0.1536,0.2146,0.3174,0.2318,0.1833,0.1999,0.2485,0.2433,0.1689,0.1604,0.0968,0.1137,0.1125,0.1454,0.1133,0.0537,0.0872,0.0373,0.0608,0.0816,0.0935,0.0946,0.1402,0.1668,0.0828,0.0274,0.0392,0.0859,0.1751,0.1896,0.0232,0.0686,0.0362,0.052,0.0351,0.0366,0.0636,0.0769,0.1169,0.0565,0.0644,0.0765,0.0749,0.0154,0.1121,0.0951,0.0099,0.1093,0.091,0.1179,0.0127,0.0202,0.0292,0.019,0.0198,0.039,0.0656,0.0311,0.0273,0.0341,0.045,0.0127,0.0195,0.0073,0.0064,0.0727,0.0624,0.0238,0.0112,0.0201,0.0166,0.0286,0.0359,0.0144,0.0024,0.0026,0.0029,0.0099,0.0016,0.0,0.0087,0.0033,0.0034,0.006,0.0125,0.0025,0.0,0.0078,0.012,0.0021,0.0,0.0011,0.0008,0.0006,0.0064,0.0003,0.0014,0.001,0.0],"expected_share_in_reference":0.0671,"id":"gistemp_below_p05_1951-1980","label":"Share of area below the local 5th percentile of 1951-1980","n_cells_with_reference":15833,"reference":"1951-1980","source":"gistemp","valid_area_share":[null,null,null,null,null,null,null,null,null,null,null,null,null,null,null,null,null,null,null,null,null,null,null,null,null,null,null,null,null,null,0.8379,0.8454,0.8548,0.8546,0.8491,0.8492,0.865,0.8685,0.8669,0.8686,0.8691,0.8781,0.8748,0.8722,0.8918,0.8842,0.893,0.9015,0.9055,0.9031,0.9116,0.9146,0.9181,0.9218,0.9266,0.9324,0.9297,0.9331,0.9333,0.9332,0.9338,0.9307,0.9354,0.9384,0.9397,0.9403,0.9399,0.9397,0.94,0.9394,0.9409,0.9398,0.9412,0.9409,0.9417,0.9421,0.9456,0.9467,0.9471,0.9471,0.947,0.9531,0.9533,0.9533,0.9478,0.9478,0.9532,0.953,0.9531,0.9539,0.9537,0.955,0.9543,0.9497,0.9521,0.9521,0.9581,0.9589,0.9597,0.959,0.9644,0.9661,0.9586,0.9586,0.9669,0.9727,0.9878,1.0,1.0,1.0,0.9996,0.9996,1.0,1.0,1.0,1.0,1.0,1.0,1.0,1.0,1.0,1.0,1.0,1.0,1.0,1.0,1.0,1.0,1.0,1.0,1.0,1.0,0.9997,0.9997,1.0,1.0,1.0,1.0,1.0,1.0,1.0,1.0,0.9998,1.0,1.0,1.0,1.0,0.9997,0.9997,1.0,0.9997,1.0,1.0,1.0,0.9997,1.0,1.0,1.0,1.0,1.0,1.0,1.0,1.0,1.0,1.0,1.0,1.0,1.0,1.0,1.0,1.0,1.0,1.0,1.0,1.0,0.9998]},{"area_share":[null,null,null,null,null,null,null,null,null,null,null,null,null,null,null,null,null,null,null,null,null,null,null,null,null,null,null,null,null,null,0.0176,0.0097,0.0209,0.0134,0.0168,0.0109,0.0121,0.0116,0.0562,0.0234,0.0192,0.0109,0.0233,0.0265,0.0267,0.0044,0.0123,0.0128,0.0127,0.0204,0.0212,0.0095,0.0219,0.0107,0.0075,0.0295,0.0115,0.0094,0.0052,0.0035,0.0077,0.0033,0.0096,0.0018,0.0226,0.0184,0.0026,0.0101,0.0102,0.0019,0.0187,0.024,0.0077,0.0041,0.0161,0.0041,0.027,0.0074,0.0213,0.0137,0.0168,0.0467,0.0327,0.0137,0.0518,0.0062,0.029,0.0469,0.0566,0.0317,0.0766,0.1102,0.0256,0.0532,0.0563,0.0287,0.0085,0.0346,0.0208,0.027,0.0131,0.0118,0.0154,0.0492,0.0243,0.0171,0.0315,0.0325,0.0154,0.0274,0.0108,0.0218,0.0348,0.0245,0.0018,0.0043,0.0114,0.0217,0.0095,0.0165,0.0092,0.0221,0.0352,0.0289,0.0213,0.0441,0.0087,0.0212,0.0197,0.0121,0.0403,0.082,0.0383,0.0922,0.0338,0.0184,0.0233,0.0979,0.0741,0.0795,0.0892,0.0904,0.0703,0.0521,0.044,0.0898,0.0668,0.1462,0.237,0.1397,0.0988,0.1492,0.1703,0.1662,0.1272,0.2205,0.1723,0.2102,0.1351,0.186,0.2721,0.1985,0.1846,0.1967,0.2538,0.4133,0.4468,0.3568,0.3203,0.3946,0.4223,0.3554,0.3503,0.5245,0.6097,0.5335],"expected_share_in_reference":null,"id":"gistemp_ge_1C_1951-1980","label":"Share of area at least +1 C above the 1951-1980 cell mean","n_cells_with_reference":15833,"reference":"1951-1980","source":"gistemp","valid_area_share":[null,null,null,null,null,null,null,null,null,null,null,null,null,null,null,null,null,null,null,null,null,null,null,null,null,null,null,null,null,null,0.8379,0.8454,0.8548,0.8546,0.8491,0.8492,0.865,0.8685,0.8669,0.8686,0.8691,0.8781,0.8748,0.8722,0.8918,0.8842,0.893,0.9015,0.9055,0.9031,0.9116,0.9146,0.9181,0.9218,0.9266,0.9324,0.9297,0.9331,0.9333,0.9332,0.9338,0.9307,0.9354,0.9384,0.9397,0.9403,0.9399,0.9397,0.94,0.9394,0.9409,0.9398,0.9412,0.9409,0.9417,0.9421,0.9456,0.9467,0.9471,0.9471,0.947,0.9531,0.9533,0.9533,0.9478,0.9478,0.9532,0.953,0.9531,0.9539,0.9537,0.955,0.9543,0.9497,0.9521,0.9521,0.9581,0.9589,0.9597,0.959,0.9644,0.9661,0.9586,0.9586,0.9669,0.9727,0.9878,1.0,1.0,1.0,0.9996,0.9996,1.0,1.0,1.0,1.0,1.0,1.0,1.0,1.0,1.0,1.0,1.0,1.0,1.0,1.0,1.0,1.0,1.0,1.0,1.0,1.0,0.9997,0.9997,1.0,1.0,1.0,1.0,1.0,1.0,1.0,1.0,0.9998,1.0,1.0,1.0,1.0,0.9997,0.9997,1.0,0.9997,1.0,1.0,1.0,0.9997,1.0,1.0,1.0,1.0,1.0,1.0,1.0,1.0,1.0,1.0,1.0,1.0,1.0,1.0,1.0,1.0,1.0,1.0,1.0,1.0,0.9998]},{"area_share":[null,null,null,null,null,null,null,null,null,null,null,null,null,null,null,null,null,null,null,null,null,null,null,null,null,null,null,null,null,null,0.0,0.0,0.0,0.0004,0.0,0.0,0.0059,0.0,0.0011,0.0059,0.0004,0.0059,0.0,0.0057,0.0013,0.0,0.0,0.0,0.0,0.0,0.0,0.0013,0.0,0.0,0.0,0.0002,0.0005,0.0011,0.0,0.0,0.0,0.0006,0.0,0.0,0.0,0.0,0.0,0.0,0.0,0.0,0.0002,0.0,0.0,0.0,0.0021,0.0,0.0089,0.0,0.0047,0.0027,0.0018,0.006,0.0,0.0004,0.0005,0.0,0.0,0.0055,0.0163,0.0011,0.0129,0.0018,0.0066,0.012,0.0088,0.0031,0.0,0.0103,0.0023,0.0,0.0,0.0,0.0,0.0057,0.0045,0.0,0.0053,0.0,0.0,0.0,0.0,0.0,0.002,0.0,0.0,0.0,0.0,0.0049,0.0,0.0009,0.0,0.0022,0.0023,0.0,0.0019,0.0025,0.0,0.0,0.002,0.0,0.0034,0.02,0.0,0.019,0.0022,0.004,0.0,0.0088,0.0007,0.0139,0.0069,0.0005,0.0001,0.0105,0.0,0.0312,0.0056,0.0157,0.0305,0.0105,0.0082,0.0089,0.0195,0.0128,0.0043,0.0338,0.0329,0.0653,0.0414,0.0147,0.0616,0.0453,0.0424,0.0158,0.043,0.0879,0.0678,0.055,0.0541,0.0784,0.0742,0.0628,0.0812,0.1318,0.1597,0.1339],"expected_share_in_reference":null,"id":"gistemp_ge_2C_1951-1980","label":"Share of area at least +2 C above the 1951-1980 cell mean","n_cells_with_reference":15833,"reference":"1951-1980","source":"gistemp","valid_area_share":[null,null,null,null,null,null,null,null,null,null,null,null,null,null,null,null,null,null,null,null,null,null,null,null,null,null,null,null,null,null,0.8379,0.8454,0.8548,0.8546,0.8491,0.8492,0.865,0.8685,0.8669,0.8686,0.8691,0.8781,0.8748,0.8722,0.8918,0.8842,0.893,0.9015,0.9055,0.9031,0.9116,0.9146,0.9181,0.9218,0.9266,0.9324,0.9297,0.9331,0.9333,0.9332,0.9338,0.9307,0.9354,0.9384,0.9397,0.9403,0.9399,0.9397,0.94,0.9394,0.9409,0.9398,0.9412,0.9409,0.9417,0.9421,0.9456,0.9467,0.9471,0.9471,0.947,0.9531,0.9533,0.9533,0.9478,0.9478,0.9532,0.953,0.9531,0.9539,0.9537,0.955,0.9543,0.9497,0.9521,0.9521,0.9581,0.9589,0.9597,0.959,0.9644,0.9661,0.9586,0.9586,0.9669,0.9727,0.9878,1.0,1.0,1.0,0.9996,0.9996,1.0,1.0,1.0,1.0,1.0,1.0,1.0,1.0,1.0,1.0,1.0,1.0,1.0,1.0,1.0,1.0,1.0,1.0,1.0,1.0,0.9997,0.9997,1.0,1.0,1.0,1.0,1.0,1.0,1.0,1.0,0.9998,1.0,1.0,1.0,1.0,0.9997,0.9997,1.0,0.9997,1.0,1.0,1.0,0.9997,1.0,1.0,1.0,1.0,1.0,1.0,1.0,1.0,1.0,1.0,1.0,1.0,1.0,1.0,1.0,1.0,1.0,1.0,1.0,1.0,0.9998]},{"area_share":[null,null,null,null,null,null,null,null,null,null,null,null,null,null,null,null,null